{
  "caller_retry_authorized": true,
  "changed_retry_condition": null,
  "diagnosed_cause": "Transient model outage.",
  "evaluation_key_digest": "sha256:0000000000000000000000000000000000000000000000000000000000000000",
  "failed_identity": "inv-1",
  "inspected_evidence_digests": [
    "sha256:1111111111111111111111111111111111111111111111111111111111111111"
  ],
  "run_id": "run-1",
  "schema": "evaluation-recovery-v1",
  "transient_failure_rationale": "Service recovered."
}
